Earmark Description,Location,Amount,Administering State Agency,State Agency Contact,Account Number,Earmark Language
"International Veterans Care Services, Inc",Lawrence,50000,EHS - Executive Office Of Health And Human Services,Thomas.Statuto@mass.gov,40000013,"provided further, that not less than $50,000 shall be expended to International Veterans Care Services, Inc in the City of Lawrence to mitigate food insecurity and provide housing relief to members of the veteran community that have been financially impacted by the novel coronavirus 2019"
Into Action Recovery,Tewksbury,50000,EHS - Executive Office Of Health And Human Services,Thomas.Statuto@mass.gov,40000013,"provided further, that not less than $50,000 shall be expended for Into Action Recovery, Inc. in the town of Tewksbury to maintain a substance abuse recovery program"
Ipswich River Park Renovations and Improvements,North Reading,100000,DCR - Department Of Conservation And Recreation,max.j.tassinari@mass.gov,15992031,"provided further, that not less than $100,000 shall be expended for renovations and improvements to the Ipswich river park located in the town of North Reading"
Irish Social Club Roof Repairs,Boston,50000,HED - Executive Office Of Economic Development,rory.c.ohanlon@mass.gov,70021530,"provided further, that not less than $50,000 shall be expended to the Irish Social Club of West Roxbury, Inc. in the West Roxbury section of the city of Boston"
IT Improvements for Braintree Public Schools,Braintree,500000,DESE - Department Of Elementary & Secondary Education,jjou@mass.gov,70100015,"provided further, that not less than $500,000 shall be expended for information technology improvements for the Braintree public school system"
"Jay's Hope and Promise, Co.",Hanson,20000,DMH - Department Of Mental Health,stephen.cidlevich@mass.gov,50110101,"provided further, that not less than $20,000 shall be expended to Jay's Hope and Promise, Co. of Hanson to assist individuals recovering from substance misuse"
Jeanne Geiger Crisis Center,"Amesbury, Lawrence",50000,EHS - Executive Office Of Health And Human Services,Thomas.Statuto@mass.gov,40000013,"provided further, that not less than $50,000 shall be expended to the Jeanne Geiger Crisis Center, Inc. in the cities of Amesbury, Lawrence and Newburyport toward supports for individuals and families impacted by domestic violence"
Jewish Alliance for Law and Social Action Housing Discrimination Curriculum,Statewide,100000,DHCD - Dept Of Housing And Community Development,alain.fabo@mass.gov,70049318,"provided further, that not less than $100,000 shall be expended for the Jewish Alliance for Law and Social Action, Inc. for the outreach and operation of the organization's non-religious “Confronting Housing Discrimination” curriculum"
Jewish Family and Children’s Service of Greater Boston,Statewide,1000000,EHS - Executive Office Of Health And Human Services,Thomas.Statuto@mass.gov,15992026,"provided further, that not less than $1,000,000 shall be expended to the Jewish Family and Children’s Service of Greater Boston to provide mental health and other wrap around services to vulnerable populations"
"Jewish Family and Children’s Service, Inc.",Canton,5000,MDAR - Department Of Agricultural Resources,cullen.roberts2@mass.gov,15992050,"(l) Jewish Family and Children’s Service, Inc. in the town of Canton"
Jewish Vocational Services - Rapid Reemployment,Statewide,10000000,LWD - Executive Office Of Labor And Workforce Development,sheila.l.tunney2@mass.gov,15992037,"provided further, that not less than $5,000,000 per year for 2 years, totaling not less than $10,000,000 by 2024, shall be expended by Jewish Vocational Service, Inc. to provide a rapid reemployment grant"
"Joanna's Place, Inc.",Weymouth,25000,ANF - Executive Office For Administration And Finance,daniel.shark@mass.gov,15992058,"provided further, that not less than $25,000 shall be expended to Joanna’s Place, Inc. in the city known as the town of Weymouth"
Job Training Programs for Immigrants in Hopkinton,Hopkinton,90000,LWD - Executive Office Of Labor And Workforce Development,sheila.l.tunney2@mass.gov,70030102,"provided further, that not less than $90,000 shall be expended to the town of Hopkinton to provide economic recovery support to members of the community, including through job training programs with a focus on populations, including immigrant populations, that have been disproportionately impacted by the 2019 novel coronavirus pandemic"
Joe Andruzzi Foundation,Statewide,50000,EHS - Executive Office Of Health And Human Services,Thomas.Statuto@mass.gov,40000013,"provided further, that not less than $50,000 shall be expended for the Joe Andruzzi Foundation Inc. in the town of North Attleborough to provide assistance to individuals of all ages and their families who are experiencing emotional and financial hardships due to cancer diagnosis to allow them to focus on their recovery, not financial challenges"
John Boyle O'Reilly Club,Springfield,50000,HED - Executive Office Of Economic Development,rory.c.ohanlon@mass.gov,70021530,"provided further, that not less than $50,000 shall be expended to the John Boyle O’Reilly Club of Springfield, Inc. in the city of Springfield"
John Silva Jr. Sports Complex,East Bridgewater,55000,MMP - Massachusetts Marketing Partnership,Phyllis.cahaly@mass.gov,15992043,"provided further, that not less than $55,000 shall be expended for renovations to the John Silva Jr. sports complex in East Bridgewater"
Joint Committee on Children's Health Care in Everett,Everett,50000,EHS - Executive Office Of Health And Human Services,Thomas.Statuto@mass.gov,40000013,"provided further, that not less than $50,000 shall be expended to the Joint Committee For Children's Health Care in Everett, Inc. in the city of Everett"
Jones River Village Historical Society,Kingston,25000,MMP - Massachusetts Marketing Partnership,Phyllis.cahaly@mass.gov,15992043,"provided further, that not less than $25,000 shall be expended for the Jones River Village Historical Society, Inc. to offset lost revenue due to the 2019 novel coronavirus pandemic"
Justice Resource Institute STRIVE Boston Job Readiness Program,Boston,75000,LWD - Executive Office Of Labor And Workforce Development,sheila.l.tunney2@mass.gov,70030102,"provided further, that not less than $75,000 shall be expended to STRIVE Boston, a job readiness program to be coordinated by the Justice Resource Institute, Inc. for job training and placement services for communities disproportionately impacted by the 2019 novel coronavirus"
Kennedy Elementary School,Brockton,250000,DESE - Department Of Elementary & Secondary Education,jjou@mass.gov,70100015,"provided further, that not less than $250,000 shall be expended for a modular classroom pod and installation at the Kennedy elementary school in the city of Brockton"
King's Beach CSO Remediation and Water Quality Improvements,Swampscott,2500000,DEP - Department Of Environmental Protection,steven.mccurdy@mass.gov,20000015,"provided further, that not less than $2,500,000 shall be expended to the town of Swampscott for projects to improve water quality at King’s beach"
King's Beach CSO Remediation Lynn,Lynn,2500000,DEP - Department Of Environmental Protection,steven.mccurdy@mass.gov,20000015,"provided further, that not less than $2,500,000 shall be expended to the city of Lynn for projects to improve water quality at King’s beach"
Kings Pond Dam Infrastructure,Raynham,100000,DCR - Department Of Conservation And Recreation,max.j.tassinari@mass.gov,15992031,"provided further, that not less than $100,000 shall be expended for the infrastructure of the King’s pond dam on Gardner street in Raynham"
Kingston Wastewater Management,Kingston,125000,DEP - Department Of Environmental Protection,steven.mccurdy@mass.gov,20000015,"provided further, that not less than $125,000 shall be made available for the town of Kingston for comprehensive wastewater management planning"
La Colaborativa in Chelsea,Chelsea,50000,EHS - Executive Office Of Health And Human Services,Thomas.Statuto@mass.gov,40000013,"provided further, that not less than $50,000 shall be expended to La Colaborativa, Inc. in the city of Chelsea"
La Comunidad in Everett,Everett,50000,HED - Executive Office Of Economic Development,rory.c.ohanlon@mass.gov,70100013,"provided further, that not less than $50,000 shall be expended to La Comunidad, Inc. in the city of Everett"
Lakeside Cemetary Chapel Restoration,Wakefield,125000,DCR - Department Of Conservation And Recreation,max.j.tassinari@mass.gov,15992031,"provided further, that not less than $125,000 shall be expended for the restoration of the Lakeside cemetery chapel in Wakefield"
Landfilling Capping and Remediation,Wendell,75000,DEP - Department Of Environmental Protection,steven.mccurdy@mass.gov,15992032,"provided further, that not less than $75,000 shall be expended to the town of Wendell for improvements to the landfill cap and remediation repairs"
Latin Women’s Association Food Distribution Program,Brockton,25000,MDAR - Department Of Agricultural Resources,cullen.roberts2@mass.gov,15992050,"provided further, that not less than $25,000 shall be expended for the Latin Women’s Association of Brockton to support their food-distribution program"
Latino Chamber of Commerce in Holyoke,Holyoke,100000,SEA - Department Of Business And Technology,nhat.le@mass.gov,70022023,"provided further, that not less than $100,000 shall be expended for the Latino Chamber of Commerce, Inc. in the city of Holyoke"
Latinos Unidos en Massachusetts (LUMA) in Everett,Everett,50000,HED - Executive Office Of Economic Development,rory.c.ohanlon@mass.gov,70021530,"provided further, that not less than $50,000 shall be expended to Latinos Unidos en Massachusetts, Inc. in the city of Everett"
Lawrence Brook Flood Mitigation Project in Peabody,Peabody,500000,DCR - Department Of Conservation And Recreation,max.j.tassinari@mass.gov,15992031,"provided further, that not less than $500,000 shall be expended to the city of Peabody for the Lawrence Brook flood mitigation project"
Lawrence CommunityWorks DyeWorks Project,Lawrence,100000,ANF - Executive Office For Administration And Finance,daniel.shark@mass.gov,15992058,"provided further, that not less than $100,000 shall be expended for Lawrence CommunityWorks, Inc. to revitalize the city of Lawrence’s historic North Canal district through the DyeWorks project"
Lawrence Partnership,Lawrence,50000,HED - Executive Office Of Economic Development,rory.c.ohanlon@mass.gov,70022023,"provided further, that not less than $50,000 shall be expended for the Lawrence Partnership, Inc. for operating expenses related to inclusive economic development in the city of Lawrence"
Lawrence Rail Construction and Expansion,Lawrence,500000,DCR - Department Of Conservation And Recreation,max.j.tassinari@mass.gov,15992031,"provided further, that not less than $500,000 shall be expended for the city of Lawrence for the construction and expansion of a rail trail"
Lazarus House,Lawrence,100000,EHS - Executive Office Of Health And Human Services,Thomas.Statuto@mass.gov,40000013,"provided further, that not less than $100,000 shall be expended for the Lazarus House, Inc. to address food and housing insecurity in the city of Lawrence"
"Leadership and Literacy Foundation, Inc.",Methuen,500000,ANF - Executive Office For Administration And Finance,daniel.shark@mass.gov,70100013,"provided further, that not less than $500,000 shall be granted to the Leadership and Literacy Foundation, Inc. toward facilities, programming and staff at the Methuen Youth and Community Center"
Leaving the Streets Ministries,Haverhill,50000,EHS - Executive Office Of Health And Human Services,Thomas.Statuto@mass.gov,40000013,"provided further, that not less than $50,000 shall be expended for Leaving the Streets Ministries in Haverhill for violence prevention and street work"
Leicester Public Schools Boiler Repairs,Leicester,85000,DESE - Department Of Elementary & Secondary Education,jjou@mass.gov,70100015,"provided further, that not less than $85,000 shall be expended to the town of Leicester for boiler replacement or repairs within the Leicester public schools"
Leominster Early Education Center Feasibility Study,Leominster,100000,EEC - Department Of Early Education & Care,sean.reynolds@mass.gov,70100013,"provided further, that not less than $100,000 shall be expended for the Leominster public schools to conduct a feasibility study for an early childhood education center"
Leominster Modular Classrooms,Leominster,300000,DESE - Department Of Elementary & Secondary Education,jjou@mass.gov,70100015,"provided further, that not less than $300,000 shall be expended to the Leominster public school district to purchase portable classrooms for all elementary schools in the district"
Leominster Public Schools Water Filtration System Improvements,Leominster,150000,DESE - Department Of Elementary & Secondary Education,jjou@mass.gov,70100015,"provided further, that not less than $150,000 shall be expended for the Leominster public schools to upgrade the water filtration systems throughout the district"
Local Rapid Recovery Plan Implementation,Winchester,150000,HED - Executive Office Of Economic Development,rory.c.ohanlon@mass.gov,15992043,"provided further, that not less than $150,000 shall be expended to the town of Winchester to implement their Local Rapid Recovery Plan"
Louison House,North Adams,75000,DHCD - Dept Of Housing And Community Development,alain.fabo@mass.gov,70049318,"provided, that not less than $75,000 shall be provided to Louison House, Inc. for the operation of an emergency homeless shelter in northern Berkshire County"
Lowell Vacant Store Fronts,Lowell,100000,HED - Executive Office Of Economic Development,rory.c.ohanlon@mass.gov,70022023,"provided further, that not less than $100,000 shall be expended to the city of Lowell for the Vacant Storefront Program to rehabilitate vacant and underutilized spaces in the city’s downtown area"
Ludlow 250th Cultural Celebration,Ludlow,50000,MMP - Massachusetts Marketing Partnership,Phyllis.cahaly@mass.gov,15992043,"provided further, that not less than $50,000 shall be expended for the cultural celebration of the 250th anniversary of the town of Ludlow"
Ludlow Mills Affordable Housing Opportunities,Ludlow,2000000,DHCD - Dept Of Housing And Community Development,alain.fabo@mass.gov,70049318,"provided further, that not less than $2,000,000 shall be expended for the Westmass Area Development Corporation for redevelopment and expansion of properties for continued predeveloped expenses associated with additional growth opportunities of affordable housing at the Ludlow Mills"
Ludlow Mills Water and Sewer Infrastructure,Ludlow,1000000,DEP - Department Of Environmental Protection,steven.mccurdy@mass.gov,15992032,"provided further, that not less than $1,000,000 shall be expended for the Westmass Area Development Corporation for new water and sewer infrastructure for the Ludlow Mills redevelopment located within an environmental justice community"
Lunenburg Primary School Hazardous Materials Abatement,Lunenburg,50000,DESE - Department Of Elementary & Secondary Education,jjou@mass.gov,70100015,"provided further, that not less than $50,000 shall be expended to the Lunenburg primary school for hazardous materials abatement"
Lupa Zoo in Ludlow,Ludlow,50000,MMP - Massachusetts Marketing Partnership,Phyllis.cahaly@mass.gov,70021530,"provided further, that not less than $50,000 shall be expended to the Lupa Zoo in the town of Ludlow to provide Americans with Disabilities Act and handicapped accessibility improvements"
Lynn Climate Resiliency Initiatives,Lynn,300000,DCR - Department Of Conservation And Recreation,max.j.tassinari@mass.gov,15992031,"provided further, that not less than $300,000 shall be expended for the Lynn department of community development for climate resiliency initiatives in the city of Lynn"
Lynn Economic Development,Lynn,300000,SEA - Department Of Business And Technology,nhat.le@mass.gov,15992043,"provided further, that not less than $300,000 shall be expended to the Lynn Economic Development & Industrial Corporation of Lynn to distribute grants to businesses that have been adversely impacted by the 2019 novel coronavirus pandemic, with preference given to women-owned and minority-owned businesses"
Lynn Senior Center,Lynn,1000000,EHS - Executive Office Of Health And Human Services,Thomas.Statuto@mass.gov,40000013,"provided further, that not less than $1,000,000 shall be expended for the construction of a senior center in the city of Lynn"
Lynn Waterfront Coastal Resiliency Project,Lynn,100000,DCR - Department Of Conservation And Recreation,max.j.tassinari@mass.gov,15992031,"provided further, that not less than $100,000 shall be expended for shoreline restoration planning in Lynn Harbor to mitigate current erosion, create a resilient shoreline adjacent to critical infrastructure, and support the transformation of a landfill into a 30-acre park"
Macomber School HVAC Systems,Westport,150000,DESE - Department Of Elementary & Secondary Education,jjou@mass.gov,70100015,"provided further, that not less than $150,000 shall be expended for the Westport community schools for the installation of heating, ventilation and air conditioning systems at the Macomber school"
"Maddie's Promise, Inc.",Hingham,25000,ANF - Executive Office For Administration And Finance,daniel.shark@mass.gov,15992058,"provided further, that not less than $25,000 shall be expended to Maddie’s Promise, Inc. in the town of Hingham"
Main South Business Association,Worcester,50000,SEA - Department Of Business And Technology,nhat.le@mass.gov,15992043,"provided further, that not less than $50,000 shall be expended for the Main South Business Association in Worcester to further assist minority entrepreneurs with technical assistance, legal services, and compliance training"
Main South Community Development Corp in Worcester,Worcester,200000,DHCD - Dept Of Housing And Community Development,alain.fabo@mass.gov,70049318,"provided further, that not less than $200,000 shall be expended for the Main South Community Development Corporation in the city of Worcester for the purpose of establishing 7 commercial rental units with lease-to-own agreements executed with move-in tenants"
Maintenance of Food Pantry and Address Food Insecurity,Bedford,100000,MDAR - Department Of Agricultural Resources,cullen.roberts2@mass.gov,15992050,"provided further, that not less than $100,000 shall be expended to the town of Bedford for the maintenance of a food pantry or to otherwise address food insecurity in Bedford"
Major Taylor Museum Worcester,Worcester,300000,MMP - Massachusetts Marketing Partnership,Phyllis.cahaly@mass.gov,15992043,"provided further, that not less than $300,000 shall be expended for the construction of the Major Taylor Museum in Worcester"
Malden Energy Efficient Street Lighting,Malden,85000,ENE - Department Of Energy Resources,Marcelle.T.Payen@mass.gov,20000103,"provided further, that not less than $85,000 shall be expended to the city of Malden for the replacement of inefficient street lighting with energy efficient alternatives"
Malden Overcoming Addiction Club 24 Facility Upgrades,Malden,60000,EHS - Executive Office Of Health And Human Services,Thomas.Statuto@mass.gov,40000013,"provided further, that not less than $60,000 shall be expended to Malden Overcoming Addiction, Inc. in the city of Malden for Club 24, Inc. facility upgrades and capital improvements"
Malden River Works Project,Malden,150000,EEA - Executive Office Of Environmental Affairs,serafina.t.zeringo@mass.gov,20000103,"provided further, that not less than $150,000 shall be expended to the city of Malden for the Malden River Works project for environmental remediation and climate resilience along the Malden River"
Malden Urban and Community Foresty Greening,Malden,100000,DCR - Department Of Conservation And Recreation,max.j.tassinari@mass.gov,15992031,"provided further, that not less than $100,000 shall be expended for the city of Malden for urban and community forestry greening"
Malden YWCA Wilcox Hall Energy Efficiency Upgrades,Malden,100000,HED - Executive Office Of Economic Development,rory.c.ohanlon@mass.gov,70100013,"provided further, that not less than $100,000 shall be expended to the Young Women’s Christian Association of Malden for energy efficiency upgrades and other capital improvements to Wilcox Hall in the city of Malden"
Mansfield Youth Baseball,Mansfield,50000,HED - Executive Office Of Economic Development,rory.c.ohanlon@mass.gov,70021530,"provided further, that not less than $50,000 shall be allocated to regional youth baseball in the town of Mansfield to make improvements to 7 baseball field bleachers"
Marblehead Resiliency Assessment,Marblehead,200000,DCR - Department Of Conservation And Recreation,max.j.tassinari@mass.gov,15992031,"provided further, that not less than $200,000 shall be expended for a resiliency assessment of coastal infrastructure in town of Marblehead"
Margaret Fuller Neighborhood House,Cambridge,50000,MDAR - Department Of Agricultural Resources,cullen.roberts2@mass.gov,15992050,"provided further, that not less than $50,000 shall be expended for the Margaret Fuller Neighborhood House in the city of Cambridge"
Marian Manor Nursing Home,Boston,250000,EHS - Executive Office Of Health And Human Services,Thomas.Statuto@mass.gov,40000013,"provided further that not less than $250,000 shall be expended for the Marian Manor for The Aged and Inform Nursing Home to modernize and replace outdated mechanics and recover extraordinary and unreimbursed expenditures incurred due to the novel coronavirus 2019"
Marine Park Playground Restoration and Improvement,Boston,100000,DCR - Department Of Conservation And Recreation,max.j.tassinari@mass.gov,15992031,"provided further, that not less than $100,000 shall be expended for continued renovations and improvements to playgrounds in Marine park in the South Boston section of Boston"
Marshfield Chamber of Commerce,Marshfield,50000,SEA - Department Of Business And Technology,nhat.le@mass.gov,70022023,"provided further, that not less than $50,000 shall be expended to the Marshfield Chamber of Commerce, Inc. to provide additional supports to small businesses in the form of grants"
Martin Luther King Jr Family Services Emergency Food Pantry,Springfield,50000,MDAR - Department Of Agricultural Resources,cullen.roberts2@mass.gov,15992050,"provided further, that not less than $50,000 shall be expended to Martin Luther King, Jr. Family Services, Inc. in Springfield for their Emergency Food Distribution Program"
Mass Fair Housing Center,Holyoke,100000,DHCD - Dept Of Housing And Community Development,alain.fabo@mass.gov,70049318,"provided, that not less than $100,000 shall be expended for the Massachusetts Fair Housing Center, Inc. in the city of Holyoke to provide housing and eviction prevention services to those adversely impacted by the 2019 novel coronavirus pandemic"
Mass211 Hotline,Framingham,1000000,EHS - Executive Office Of Health And Human Services,Thomas.Statuto@mass.gov,40000013,"provided further, that not less than $1,000,000 shall be expended for the Mass211, Inc.’s statewide hotline to connect residents to mental health services, substance abuse disorder treatment supports and other critical health and human services"
Massachusetts Alliance for Supportive Housing,Statewide,15000000,DHCD - Dept Of Housing And Community Development,alain.fabo@mass.gov,15992023,"provided further, that not less than $15,000,000 shall be expended for the Massachusetts Alliance for Supportive Housing LLC for the creation of supportive housing to address the public health emergency of homelessness, exacerbated by COVID-19, due to densely populated congregate shelters and growing encampments of unsheltered individuals"
"Massachusetts Alliance of Boys & Girls Clubs, Inc.",Statewide,10000000,HED - Executive Office Of Economic Development,rory.c.ohanlon@mass.gov,15992047,"provided further, that the department shall award not less than $10,000,000 to the Massachusetts Alliance of Boys & Girls Clubs, Inc., which shall be distributed among its member organizations"
Massachusetts Alliance of Portuguese Speakers,Cambridge,50000,HED - Executive Office Of Economic Development,rory.c.ohanlon@mass.gov,15992043,"provided further, that not less than $50,000 shall be expended for the Massachusetts Alliance of Portuguese Speakers, Inc. in the city of Cambridge"
Massachusetts Arts Stagecraft Initiative,Boston,500000,MMP - Massachusetts Marketing Partnership,Phyllis.cahaly@mass.gov,15992043,"provided further, that not less than $500,000 shall be expended for the Boston Arts Summer Institute, Inc., to operate the Massachusetts Arts Stagecraft Initiative to support the theater arts and entertainment industry directly impacted by the 2019 novel coronavirus pandemic, through job training, workforce development and diversification"
Massachusetts Down Syndrome Congress,Statewide,500000,LWD - Executive Office Of Labor And Workforce Development,sheila.l.tunney2@mass.gov,15992037,"provided further, that not less than $500,000 shall be expended to the Massachusetts Down Syndrome Congress, Inc. for the Your Next Star Employment Academy to provide job training and job placement for individuals with Down syndrome whose jobs were eliminated during the 2019 novel pandemic"
Massachusetts Fallen Heroes,Boston,75000,EHS - Executive Office Of Health And Human Services,Thomas.Statuto@mass.gov,40000013,"provided further, that not less than $75,000 shall be expended to Massachusetts Fallen Heroes, Inc."
